{
  "title": "Design Patterns in Practice",
  "description": "A hands-on exploration of the classic Gang of Four patterns applied to modern software.",
  "pageCount": 428,
  "excerpt": "Patterns are not blueprints; they are starting points for conversation.",
  "publishDate": "2024-09-15T00:00:00Z"
}
